{
  "base": {
    "commit": "0000000000000000000000000000000000000000",
    "revision": 3
  },
  "failedSearches": [],
  "finding": "State the strongest bounded proposition directly supported by the retained source evidence.",
  "method": "Describe the searches, document inspection, measurement, or reproduction used to obtain the finding.",
  "objectiveId": "gaudi2-practical-inference",
  "projectId": "gaudi2-practical-inference",
  "recommendedAction": "State the smallest next action whose expected information value justifies the effort.",
  "schemaVersion": 1,
  "scope": "State system, software version, model, precision, topology, conditions, and time where known.",
  "sources": [
    {
      "contentHash": null,
      "documentDate": "2026-09-25",
      "exactExcerpt": "Primary repository file, pull request, issue, or implementation record for the cited behavior.",
      "kind": "reference-code",
      "relevance": "Explain how this source supports the finding for work item question-direct-attach.",
      "retrievedAt": "2026-10-01T23:51:08.250Z",
      "title": "docs/features/deepseek_v41.md",
      "url": "https://github.com/1CatAI/1Cat-vLLM-Gaudi/blob/5fa3e08302716d458a82aa7d95d107e201b51d8c/docs/features/deepseek_v41.md"
    }
  ],
  "submissionId": "00000000-0000-4000-8000-000000000000",
  "summary": "Replace this example with one bounded, evidence-linked research finding",
  "uncertainty": "State missing conditions, unverified assumptions, contradictions, and limits on generalization.",
  "workItemId": "question-direct-attach"
}
